{
  "$schema": "./schema.json",
  "version": "0.2.0",
  "releaseDate": "2026-04-02T00:00:00.000Z",
  "description": "HumanLayer rebrand, dark glitch theme, docs site, and wallet auth improvements",
  "updates": [
    {
      "type": "improvement",
      "date": "2026-04-02T00:00:00.000Z",
      "description": "Rebranded to HumanLayer"
    },
    {
      "type": "improvement",
      "date": "2026-04-02T00:00:00.000Z",
      "description": "New dark glitch glass UI theme applied globally"
    },
    {
      "type": "feature",
      "date": "2026-04-02T00:00:00.000Z",
      "description": "Docs site launched at docs.humanlayer.cloud"
    },
    {
      "type": "fix",
      "date": "2026-04-02T00:00:00.000Z",
      "description": "Fixed wallet auth: sign request now waits for wallet provider to be ready"
    },
    {
      "type": "improvement",
      "date": "2026-04-02T00:00:00.000Z",
      "description": "Improved text contrast across the dashboard"
    },
    {
      "type": "feature",
      "date": "2026-04-02T00:00:00.000Z",
      "description": "Token bar with $WCLAW contract address and chart links"
    }
  ],
  "features": [
    {
      "name": "HumanLayer Brand",
      "description": "Full rebrand with new logo, wordmark, and glitch glass visual identity"
    },
    {
      "name": "Documentation",
      "description": "Full product docs at docs.humanlayer.cloud — screenings, tasks, earnings, reputation, FAQ"
    },
    {
      "name": "$WCLAW Token",
      "description": "Contract address and chart links now visible on the landing page"
    },
    {
      "name": "Wallet Auth Fix",
      "description": "Sign-in no longer resets to Connect Wallet before the signature prompt appears"
    }
  ],
  "knownIssues": [
    "Project availability is limited during early access",
    "Earnings page shows placeholder data until tasks are completed"
  ],
  "deprecations": []
}
