{
  "$schema": "./schema.json",
  "version": "0.1.0",
  "releaseDate": "2026-03-01T00:00:00.000Z",
  "description": "Initial MVP release of HumanLayer — the first crypto-native AI training platform",
  "updates": [
    {
      "type": "feature",
      "date": "2026-03-01T00:00:00.000Z",
      "description": "Solana wallet sign-in (SIWS)"
    },
    {
      "type": "feature",
      "date": "2026-03-01T00:00:00.000Z",
      "description": "Contributor dashboard with opportunities, screenings, and tasks"
    },
    {
      "type": "feature",
      "date": "2026-03-01T00:00:00.000Z",
      "description": "Screening qualification system"
    },
    {
      "type": "feature",
      "date": "2026-03-01T00:00:00.000Z",
      "description": "Pairwise comparison task flow"
    }
  ],
  "features": [
    {
      "name": "Solana Authentication",
      "description": "Sign in with any Solana wallet — no email or personal info required"
    },
    {
      "name": "Screenings",
      "description": "Pass qualification tests to unlock AI training projects"
    },
    {
      "name": "Task System",
      "description": "Claim and complete pairwise comparison and annotation tasks"
    },
    {
      "name": "SOL Rewards",
      "description": "Earn SOL directly to your wallet for completed screenings and tasks"
    }
  ],
  "knownIssues": [
    "Some API endpoints are still in progress",
    "Session may expire unexpectedly in some cases",
    "Limited projects available during early access — more being added"
  ],
  "deprecations": []
}
